{
  "slug": "a-houseplant-that-thinks-it-can-rule-the-world",
  "date": "2026-06-30",
  "idea": "a houseplant that thinks it can rule the world",
  "title_options": [
    "A Houseplant That Thinks It Can Rule The World? Here's the truth",
    "The A Houseplant That Thinks It Can Rule The World thing nobody tells you",
    "You're wrong about A Houseplant That Thinks It Can Rule The World",
    "A Houseplant That Thinks It Can Rule The World — explained in 30 seconds",
    "Watch this before you judge A Houseplant That Thinks It Can Rule The World"
  ],
  "primary_title": "A Houseplant That Thinks It Can Rule The World? Here's the truth",
  "description": "A fast, cinematic short about a houseplant that thinks it can rule the world. Watch to the end for the turn. New shorts regularly — follow so you don't miss the next one.",
  "hashtags": [
    "#shorts",
    "#ahouseplantthatthinksitcanruletheworld",
    "#cinematic",
    "#fyp",
    "#storytime"
  ],
  "format": {
    "aspect_ratio": "9:16",
    "target_seconds": 32,
    "scene_count": 6,
    "seconds_per_scene_range": "4-7"
  },
  "platforms": [
    "YouTube Shorts",
    "TikTok",
    "Instagram Reels",
    "X"
  ],
  "tone": "cinematic, fast, clear, high-retention",
  "style": "cinematic, high-contrast, shallow depth of field, filmic color grade",
  "scenes": [
    {
      "n": 1,
      "beat": "HOOK",
      "start": 0,
      "end": 5,
      "duration": 5,
      "camera": "low-angle hero shot",
      "motion": "slow dolly-in, subtle parallax",
      "lighting": "dramatic rim light, dark background",
      "voiceover": "Stop scrolling. This is a houseplant that thinks it can rule the world — and it's not what you think."
    },
    {
      "n": 2,
      "beat": "SETUP",
      "start": 5,
      "end": 10,
      "duration": 5,
      "camera": "slow push-in (dolly)",
      "motion": "smooth orbit around subject",
      "lighting": "soft golden-hour key light",
      "voiceover": "Here's the thing about a houseplant that thinks it can rule the world that almost nobody notices."
    },
    {
      "n": 3,
      "beat": "ESCALATION",
      "start": 10,
      "end": 15,
      "duration": 5,
      "camera": "over-the-shoulder medium",
      "motion": "handheld micro-shake for energy",
      "lighting": "cool blue moody backlight",
      "voiceover": "But it gets bigger. Watch what happens next."
    },
    {
      "n": 4,
      "beat": "TURN",
      "start": 15,
      "end": 20,
      "duration": 5,
      "camera": "top-down birds-eye",
      "motion": "rapid push then settle",
      "lighting": "high-key bright and clean",
      "voiceover": "And that's when everything about a houseplant that thinks it can rule the world changes."
    },
    {
      "n": 5,
      "beat": "PAYOFF",
      "start": 20,
      "end": 25,
      "duration": 5,
      "camera": "tracking side profile",
      "motion": "crane up reveal",
      "lighting": "neon practical lights, teal/magenta",
      "voiceover": "That's the part that sticks with you."
    },
    {
      "n": 6,
      "beat": "BUTTON",
      "start": 25,
      "end": 30,
      "duration": 5,
      "camera": "close-up on face/detail",
      "motion": "whip-pan transition out",
      "lighting": "single hard spotlight, deep shadows",
      "voiceover": "Follow for more. You'll want to see what's next."
    }
  ],
  "assets": {
    "concept": "concept.md",
    "script": "script.md",
    "voiceover": "voiceover.md",
    "scenes": "scenes.md",
    "image_prompts": "higgsfield-image-prompts.md",
    "video_prompts": "higgsfield-video-prompts.md",
    "captions": "captions.srt",
    "thumbnail": "thumbnail.md",
    "social": "social-posts.md"
  },
  "status": "draft",
  "generated_by": "Higgsfield_Youtubengine/new-video"
}